{
  "schema_version": "1.0",
  "task_id": "sample_001",
  "module": "m3_calibration_calculation",
  "status": "ok",
  "frontend_input": {
    "spots_calib_path": "mock_input/spots_calib_ok.json",
    "spots_meas_path": "mock_input/spots_meas_ok.json",
    "config_path": "docs/default_config.json",
    "lens_result_mode": "auto"
  },
  "must_read_upstream_output": [
    "mock_input/spots_calib_ok.json",
    "mock_input/spots_meas_ok.json"
  ],
  "expected_output": [
    "result_spherical_ok.json",
    "result_cylindrical_ok.json"
  ],
  "error": null
}
